Album,Artist,Genre,Favorite Songs,Rating
"Magic, Alive!",McKinley Dixon,Jazz Rap,"Magic, Alive!, Run, Run, Run Pt. II, Sugar Water",g
Only Dust Remains,Backxwash,Experimental Hip Hop,"History Of Violence, Wake Up, 9th Heaven",g
"Sincerely,",Kali Uchis,Soul / Alternative R&B,"Heaven is a Home…, Lose My Cool,, Angels All Around Me…",g
Getting Killed,Geese,Indie Rock / Art Rock,"Cobra, Taxes, Long Island City Here I Come",g
The Crux,Djo,Indie Pop / Pop Rock,"Potion, Lonesome Is A State of Mind, Charlie's Garden",s
Equus Asinus,Men I Trust,Bedroom Pop,"All My Candles, The Landkeeper, I Come With Mud",s
勇気,betcover!!,Jazz Rock / Art Rock,"ゴーゴースチーム, ミー子のコンサート, 野猿",s
choke enough,Oklou,Alt-Pop / Electronic,"blade bird, plague dogs, harvest sky",s
Son Of Spergy,Daniel Caesar,Singer-Songwriter / R&B,"Sins Of The Father (Feat. Bon Iver), Sign Of The Times, Have A Baby (With Me)",s
NEVER ENOUGH,Turnstile,Hardcore Punk / Dream Pop,"I CARE, NEVER ENOUGH, SUNSHOWER",s
Fancy That,PinkPantheress,Dance Pop / Drum and Bass,"Stateside, Nice to Know You, Romeo",s
Ace,Madison Cunningham,Singer-Songwriter / Chamber Folk,"Beyond That Moon, Shore, Skeletree",s
Vendrán Suaves Lluvias,Silvana Estrada,Chamber Folk / Singer-Songwriter,"Como Un Pájaro, Flores, Dime",s
I Love My Computer,Ninajirachi,Electro House,"iPod Touch, All I Am, Infohazard",s
"Patience, Moonbeam",Great Grandpa,Indie Rock / Dream Pop,"Never Rest, Doom, Kid",s
newLove,juno,Emo Rap / Bedroom Pop,"play with fire, temporary crush, more up than eva",s
God's Gonna Give You a Million Dollars,Shallowater,Slowcore / Alt-Country,"Ativan, God's Gonna Give You a Million Dollars, Sadie",s
LOOP:GLAMOUR,loopcinema,Synthpop / Glitch Pop,"MERCÚRIO, LOUCAS-NO-BEAT, DISCO: Lada",s
Lotus,Little Simz,Conscious Hip Hop,"Lotus, Free, Only",s
sankofa,redveil,Jazz Rap / Conscious Hip Hop,"time (a dream deferred), brown sugar, mini me",s
Pilgrim,Jesse Welles,Americana / Singer-Songwriter,"Will The Computer Love The Sunset, We’re All Gonna Die, Philanthropist (feat. Billy Strings)",s
Egotrip,"John michel, Anthony James",Chipmunk Soul / Conscious Hip Hop,"Don't Save Me, world's end, NOBODY",s
Prema,Fujii Kaze,Contemporary R&B,"Casket Girl, Love Like This, Hachikō",s
Ginkgo,Panchiko,Indie Rock,"Ginkgo, Lifestyle Trainers, Chapel of Salt",b
Forever Howlong,"Black Country, New Road",Art Rock,"Nancy Tries to Take the Night, Happy Birthday, Two Horses",b
Hers,Matt Maltese,Indie Pop / Art Pop,"Arthouse Cinema, Buses Replace Trains, Anytime, Anyplace, Anyhow",b
In The Blue Light,Kelela,Soul / R&B,"Waitin’ (unplugged), Bankhead (unplugged), Take Me Apart (unplugged)",b
Fairyland Codex,Tropical Fuck Storm,Art Punk,"Irukandji Syndrome, Teeth Marché, Bloodsport",b
Vice City Magic,Mustard Service,Indie Pop,"Yucky's Song, Going Nowhere, Big Time",b
Adult Romantix,Winter,Shoegaze,"Just Like A Flower, Misery, Without You",b
EUSEXUA,FKA twigs,Art Pop / Techno,"Eusexua, Perfect Stranger, Girl Feels Good",b
viagr aboys,Viagra Boys,Dance Punk,"Pyramid of Health, Man Made of Meat, The Bog Body",b
Racing Mount Pleasant,Racing Mount Pleasant,Chamber Pop / Art Rock,"Your New Place, Emily, Outlast",b
Phantom Island,King Gizzard & The Lizard Wizard,Symphonic Rock,"Deadstick, Phantom Island, Grow Wings and Fly",b
La Vida Era Más Corta,Milo j,Art Pop / Latin Folk,"Niño, Ama De Mi Sol, Recordé",b
"Lust for Life, Or: 'How To Thread The Needle And Come Out The Other Side To Tell The Story'",Courting,Indie Rock / Dance-Punk,"Lust for Life, After You, Eleven Sent (This Time)",b
Sky Record,Dan English,Neo-Psychedelia / Chamber Folk,"Need, Across My Jaw, Sky Record Song",b
Pretty People Blot Out The Sun,Watson Moon,Indie Folk / Singer-Songwriter,"Turn Away, Autobahn (Unmarked Van), Jacob In The Chamber",b
Y’all,glaive,Digicore / Pop Rap,"Asheville, Fuck, We Don't Leave the House",b
For Melancholy Brunettes (& sad women),Japanese Breakfast,Indie Folk / Singer-Songwriter,"Here is Someone, Orlando in Love, Winter in LA",b
Baby,Dijon,Alternative R&B / Neo-Psychedelia,"Automatic, Yamaha, Kindalove",b
Cancionera,Natalia Lafourcade,Singer-Songwriter / Latin Jazz,"El Palomo y La Negra, El Coconito, Apertura Cancionera",b
Lonely People With Power,Deafheaven,Blackgaze / Post-Metal,"Amethyst, Doberman, The Garden Route",b
Burnover,Greg Freeman,Indie Rock / Alt-Country,"Gallic Shrug, Point and Shoot, Rome, New York",b
"Um Mar Pra Cada Um,",Luedji Luna,Progressive Soul / Jazz Fusion,"Dentro Ali, Karma, Salty",b
Black Hole Superette,Aesop Rock,Abstract Hip Hop,"Unbelievable Shenanigans, So Be It, Himalayan Yak Chew",b
Holo Boy,This Is Lorelei,Indie Pop,"Dreams Away, I Can't Fall, SF & GG",b
A Matter of Time,Laufey,Jazz Pop,"Lover Girl, Tough Luck, Clockwork",b
Twilight Override,Jeff Tweedy,Singer-Songwriter / Contemporary Folk,"Enough, One Tiny Flower, KC Rain (No Wonder)",b
Equus Caballus,Men I Trust,Bedroom Pop,"Ring Of Past (2025), Come Back Down, To Ease You",b
TIDE/TIED,Thanya Iyer,Art Pop,"Wash it all away, Low Tides, I am here now",b
"SABLE, fABLE",Bon Iver,Pop Soul / Indie Folk,"Everything Is Peaceful Love, If Only I Could Wait, Walk Home",b
The Art of Loving,Olivia Dean,Pop Soul,"So Easy (To Fall In Love), Nice To Each Other, Lady Lady",b
Evangelic Girl is a Gun,yeule,Pop Rock / Alternative Pop,"Dudu, Tequila Coma, Evangelic Girl is a Gun",b
The Scholars,Car Seat Headrest,Indie Rock,"Reality, CCF (I'm Gonna Stay With You), The Catastrophe (Good Luck With That, Man)",b
Clarity of Cal,Vulfpeck,Funk / Pop Soul,"Big Dipper, Matter of Time, New Beastly",b
Addison,Addison Rae,Alternative Pop / Alternative R&B,"Fame is a Gun, Aquamarine, Headphones On",b
"by them, by you, by me",Harmless,Bedroom Pop,"why do you do this to me?, what's another year?, future music",b
I I,Blood Abscission,Atmospheric Black Metal,"I I - I, I I - I I I, I I - V",b
Animaru,Mei Semones,Indie Pop / Bossa Nova,"Dumb Feeling, I can do what I want, Tora Moyo",b
a seasons end.,drug bug,Noise Pop,"a seasons end., boy kisser, dont talk to me or ill kill myself :3",b
Mark William Lewis,mark william lewis,Singer-Songwriter /Slowcore,"Still Above, Petals, Ecstatic Heads",b
DON'T TAP THE GLASS,"Tyler, The Creator",Pop Rap / Dance,"Sucka Free, Ring Ring Ring, Big Poe (feat. Sk8brd)",b
CRYSALIS,Jenevieve,Contemporary R&B / Neo-Soul,"Naive, Hvn High, Crysalis",u
BELOVED,GIVĒON,Contemporary R&B / Pop Soul,"MUD, RATHER BE, TWENTIES",u
LOWER,Benjamin Booker,Art Rock / Neo-Soul,"SAME KIND OF LONELY, BLACK OPPS, SHOW AND TELL",u
QUIT QUIETLY,落日飛車 Sunset Rollercoaster,Soft Rock / Indie Pop,"Satellite, Wind of Tomorrow, Bluebird",u
K1,kmoe,Indietronica / Indie Rock,"Thousand yard stare, Aired out, Don't be like mouse",u
Fall Back,Florence Road,Indie Rock,"Hand Me Downs, Goodnight, Heavy",u
